0,Coffé Americano,34.0,50,ALL,DRINK,HOT_COFFEE,Black coffee like my soul
1,Caramel Macchiato,56.0,20,ALL,DRINK,COLD_COFFEE,Sweet af it might give you a heart attack or diabetes
2,Donut,47.0,20,ALL,FOOD,DESSERT,Just a donnut what do u expect
3,Pumpkin Spice Latte,69.0,102,FALL,DRINK,HOT_LATTE,The favorite of Evangelion
4,Frappe Matcha,120.0,20,SPRING,DRINK,COLD_DRINK,Matchaaaaaaa
5,Iced Moka,56.0,55,SPRING,DRINK,COLD_DRINK,Ice ice baby
6,Hot chocolate,40.0,33,WINTER,DRINK,HOT_DRINK,With marshmallows is heaven
